{
  "id": "biblioteka",
  "title": "Книжная полка",
  "description": "Что почитать по каждой эпохе: учебники, монографии, биографии ЖЗЛ и сборники документов. Самих файлов в приложении нет: добавьте книгу в «Библиотеку», и приложение само узнает её по имени файла и подставит правильное название.",
  "version": "0.1.0",
  "generated": "human",
  "priority": 10
}
